{"schema_version":"apxm.air.v1","semantic_operations":[{"node_id":"node.turn.model","op":"model.call","operands":{"model_target_ref":"model.default"}},{"node_id":"node.turn.tool","op":"capability.invoke","operands":{"capability_ref":"cap.search"}},{"node_id":"node.specialist.new","op":"program.new"},{"node_id":"node.specialist.invoke","op":"program.invoke"},{"node_id":"node.turn.await","op":"await.event"}],"structural_ir":[{"region_id":"region.loop.turn","kind":"loop"},{"region_id":"region.return","kind":"return"}],"source_map":{"schema_version":"apxm.source-map.v1","source_language":"python","node_spans":[],"region_annotations":[{"region_id":"region.loop.turn","annotation":"conversational_loop"}]}}
