{"schema_version":"apxm.air.v1","semantic_operations":[{"node_id":"node.acp.1","op":"capability.invoke","operands":{"capability_ref":"external-agent:acp:claude-code","external_agent_session":"session.acp.1"}}],"structural_ir":[{"region_id":"region.fn.Delegator","kind":"function"},{"region_id":"region.entry.Delegator","kind":"region"},{"region_id":"block.entry.Delegator","kind":"block"},{"region_id":"block.semantic.body","kind":"block"},{"region_id":"region.return.1","kind":"return"}],"source_map":{"schema_version":"apxm.source-map.v1","source_language":"python","node_spans":[],"region_annotations":[]}}
